{
  "schema_version": "1.0.0",
  "request_ref": {
    "id": "Request.txt",
    "sha256": "c44e28f3cd7468a35cae6b204a801884ddf56b88d7c0e4f3602ec984498944bf"
  },
  "interpretation": {
    "problem": {
      "id": "problem:1",
      "text": "Retrieval latency in the supplied data lake baseline",
      "source_spans": [
        {
          "source_ref": {
            "id": "Request.txt",
            "sha256": "c44e28f3cd7468a35cae6b204a801884ddf56b88d7c0e4f3602ec984498944bf"
          },
          "start": 0,
          "end": 70
        }
      ]
    },
    "desired_change": {
      "id": "change:1",
      "text": "Reduce retrieval latency while preserving answer quality",
      "source_spans": [
        {
          "source_ref": {
            "id": "Request.txt",
            "sha256": "c44e28f3cd7468a35cae6b204a801884ddf56b88d7c0e4f3602ec984498944bf"
          },
          "start": 0,
          "end": 102
        }
      ]
    },
    "requested_result": {
      "id": "result:1",
      "text": "A reproducible comparison report",
      "source_spans": [
        {
          "source_ref": {
            "id": "Request.txt",
            "sha256": "c44e28f3cd7468a35cae6b204a801884ddf56b88d7c0e4f3602ec984498944bf"
          },
          "start": 103,
          "end": 144
        }
      ]
    }
  },
  "context": [
    {
      "id": "context:baseline",
      "name": "supplied data lake baseline",
      "role": "baseline project",
      "source_spans": [
        {
          "source_ref": {
            "id": "Request.txt",
            "sha256": "c44e28f3cd7468a35cae6b204a801884ddf56b88d7c0e4f3602ec984498944bf"
          },
          "start": 29,
          "end": 57
        }
      ]
    }
  ],
  "in_scope": [
    {
      "id": "scope:1",
      "text": "Supplied data lake baseline",
      "source_spans": [
        {
          "source_ref": {
            "id": "Request.txt",
            "sha256": "c44e28f3cd7468a35cae6b204a801884ddf56b88d7c0e4f3602ec984498944bf"
          },
          "start": 29,
          "end": 57
        }
      ]
    }
  ],
  "out_of_scope": [],
  "constraints": [
    {
      "id": "constraint:gpu",
      "text": "One GPU",
      "category": "hardware",
      "source_spans": [
        {
          "source_ref": {
            "id": "Request.txt",
            "sha256": "c44e28f3cd7468a35cae6b204a801884ddf56b88d7c0e4f3602ec984498944bf"
          },
          "start": 61,
          "end": 68
        }
      ]
    }
  ],
  "preferences": [],
  "user_targets": [
    {
      "id": "target:quality",
      "metric": "answer quality",
      "target_text": "preserve answer quality",
      "source_spans": [
        {
          "source_ref": {
            "id": "Request.txt",
            "sha256": "c44e28f3cd7468a35cae6b204a801884ddf56b88d7c0e4f3602ec984498944bf"
          },
          "start": 75,
          "end": 102
        }
      ]
    }
  ],
  "context_refs": [],
  "uncertainties": [],
  "readiness": {
    "status": "ready",
    "reason": "Purpose and requested result are explicit; experimental protocol can be determined later"
  }
}
